{
  "$schema": "https://unpkg.com/lighthouse-plugin-ecoindex-core@latest/input-file/schema.json",
  "extra-header": {
    "Cookie": "monster=blue",
    "x-men": "wolverine"
  },
  "output": ["html", "json", "statement"],

  "user-agent": "random",
  "output-path": "./reports/file",
  "courses": [
    {
      "name": "Simple Test Page",
      "target": "Test minimal HTML structure",
      "course": "Testing DOM counting on simple page",
      "is-best-pages": true,
      "urls": ["http://localhost:3000/simple"]
    },
    {
      "name": "Shadow DOM Test",
      "target": "Test Shadow DOM counting",
      "course": "Verify that Shadow DOM elements are included",
      "is-best-pages": false,
      "urls": ["http://localhost:3000/shadow-dom"]
    },
    {
      "name": "Complex Test",
      "target": "Test complex case: SVG + Shadow DOM",
      "course": "Verify SVG exclusion within Shadow DOM",
      "is-best-pages": false,
      "urls": ["http://localhost:3000/svg-shadow-dom"]
    },
    {
      "name": "Heavy Impact Test",
      "target": "Test high environmental impact page",
      "course": "Verify ecoindex < 65 with 800+ DOM nodes",
      "is-best-pages": false,
      "urls": ["http://localhost:3000/heavy"]
    },
    {
      "name": "Complete Test Suite",
      "target": "Run all test pages",
      "course": "Full validation of DOM counting logic",
      "is-best-pages": false,
      "urls": [
        "http://localhost:3000/simple",
        "http://localhost:3000/svg",
        "http://localhost:3000/shadow-dom",
        "http://localhost:3000/svg-shadow-dom",
        "http://localhost:3000/complex",
        "http://localhost:3000/heavy",
        "http://localhost:3000/bp-violations"
      ]
    }
  ]
}
